<?xml version="1.0"?>
<!DOCTYPE Boek SYSTEM "..\oef-2_1.dtd">

<Boek boeknr="405" isbn="1590590104">
	<Titel>Database Programming with C#</Titel>
	<Schrijver>Thomsen</Schrijver>
	<Uitgever>Apress</Uitgever>
	<Curriculum nr="38">
		<Naam>.NET ontwikkelaar met C#</Naam>
		<Beroepencode>750412</Beroepencode>
	</Curriculum>
	<Onderwerp nr="11">C#</Onderwerp>
</Boek>